{"schema_version":"2.0.0","election_year":2021,"election_type":"midterm","unit":"state","source_id":"ine_counted_lists","rate_unit":"proportion","data":[{"election_year":2021,"state_code":"1","LN":1017420,"SV":489469,"NV":499413,"NS":28538,"source_row_count":85457,"sex_2_source_rows":0,"sex_2_nominal_count":0,"state_name":"AGUASCALIENTES","district_reference_year":2021,"specified_count":988882,"participation_observed":0.4949720998056391,"nonparticipation_observed":0.505027900194361,"participation_nominal":0.4810884393858977,"unspecified_rate":0.028049379803817498,"is_observed_undefined":false,"is_nominal_undefined":false,"has_low_registered_count":false,"has_low_specified_count":false,"has_few_source_rows":false,"has_low_support":false,"has_high_ns":false,"election_type":"midterm","section_count":622,"LN_U":685862,"section_ln_share_U":0.6741188496392837,"LN_R":111099,"section_ln_share_R":0.10919679188535708,"LN_M":220459,"section_ln_share_M":0.21668435847535925,"supported_segments":66,"supported_LN":1017340,"supported_nominal_fraction":0.9999213697391441,"profile_ids":["adult_favorable","adult_unfavorable","older_favorable","older_unfavorable","young_favorable","young_unfavorable"]},{"election_year":2021,"state_code":"10","LN":1333864,"SV":546301,"NV":752105,"NS":35458,"source_row_count":178707,"sex_2_source_rows":0,"sex_2_nominal_count":0,"state_name":"DURANGO","district_reference_year":2021,"specified_count":1298406,"participation_observed":0.4207474395528055,"nonparticipation_observed":0.5792525604471945,"participation_nominal":0.4095627440278769,"unspecified_rate":0.02658291999784086,"is_observed_undefined":false,"is_nominal_undefined":false,"has_low_registered_count":false,"has_low_specified_count":false,"has_few_source_rows":false,"has_low_support":false,"has_high_ns":false,"election_type":"midterm","section_count":1369,"LN_U":875900,"section_ln_share_U":0.6566636478681485,"LN_R":331642,"section_ln_share_R":0.24863254424738954,"LN_M":126322,"section_ln_share_M":0.09470380788446199,"supported_segments":234,"supported_LN":1333688,"supported_nominal_fraction":0.999868052515099,"profile_ids":["adult_favorable","adult_unfavorable","older_unfavorable","young_favorable","young_unfavorable"]},{"election_year":2021,"state_code":"11","LN":4583718,"SV":1948742,"NV":2525104,"NS":109872,"source_row_count":444064,"sex_2_source_rows":0,"sex_2_nominal_count":0,"state_name":"GUANAJUATO","district_reference_year":2021,"specified_count":4473846,"participation_observed":0.4355854001232944,"nonparticipation_observed":0.5644145998767056,"participation_nominal":0.42514439151797734,"unspecified_rate":0.023970060985427113,"is_observed_undefined":false,"is_nominal_undefined":false,"has_low_registered_count":false,"has_low_specified_count":false,"has_few_source_rows":false,"has_low_support":false,"has_high_ns":false,"election_type":"midterm","section_count":3161,"LN_U":2894257,"section_ln_share_U":0.63142126108107,"LN_R":1186164,"section_ln_share_R":0.2587776996752418,"LN_M":503297,"section_ln_share_M":0.1098010392436882,"supported_segments":276,"supported_LN":4583265,"supported_nominal_fraction":0.9999011719307339,"profile_ids":["adult_favorable","adult_unfavorable","older_favorable","older_unfavorable","young_favorable","young_unfavorable"]},{"election_year":2021,"state_code":"12","LN":2563061,"SV":1405231,"NV":1088952,"NS":68878,"source_row_count":352881,"sex_2_source_rows":0,"sex_2_nominal_count":0,"state_name":"GUERRERO","district_reference_year":2021,"specified_count":2494183,"participation_observed":0.5634033268609401,"nonparticipation_observed":0.43659667313906,"participation_nominal":0.5482627998319197,"unspecified_rate":0.026873336217905074,"is_observed_undefined":false,"is_nominal_undefined":false,"has_low_registered_count":false,"has_low_specified_count":false,"has_few_source_rows":false,"has_low_support":false,"has_high_ns":false,"election_type":"midterm","section_count":2685,"LN_U":1292618,"section_ln_share_U":0.5043258822166152,"LN_R":922420,"section_ln_share_R":0.35988999091320883,"LN_M":348023,"section_ln_share_M":0.13578412687017594,"supported_segments":486,"supported_LN":2562105,"supported_nominal_fraction":0.9996270084871175,"profile_ids":["adult_favorable","adult_unfavorable","older_favorable","older_unfavorable","young_favorable","young_unfavorable"]},{"election_year":2021,"state_code":"13","LN":2240326,"SV":1001176,"NV":1174720,"NS":64430,"source_row_count":240308,"sex_2_source_rows":0,"sex_2_nominal_count":0,"state_name":"HIDALGO","district_reference_year":2021,"specified_count":2175896,"participation_observed":0.46012125579531377,"nonparticipation_observed":0.5398787442046863,"participation_nominal":0.44688853318668803,"unspecified_rate":0.02875920736535665,"is_observed_undefined":false,"is_nominal_undefined":false,"has_low_registered_count":false,"has_low_specified_count":false,"has_few_source_rows":false,"has_low_support":false,"has_high_ns":false,"election_type":"midterm","section_count":1762,"LN_U":824672,"section_ln_share_U":0.3681035706410585,"LN_R":868753,"section_ln_share_R":0.3877797249150347,"LN_M":546901,"section_ln_share_M":0.24411670444390682,"supported_segments":504,"supported_LN":2239889,"supported_nominal_fraction":0.9998049391026127,"profile_ids":["adult_favorable","adult_unfavorable","older_favorable","older_unfavorable","young_favorable","young_unfavorable"]},{"election_year":2021,"state_code":"14","LN":6214764,"SV":2844834,"NV":3160033,"NS":209897,"source_row_count":513309,"sex_2_source_rows":0,"sex_2_nominal_count":0,"state_name":"JALISCO","district_reference_year":2021,"specified_count":6004867,"participation_observed":0.47375470597433716,"nonparticipation_observed":0.5262452940256629,"participation_nominal":0.4577541480255726,"unspecified_rate":0.03377392930769375,"is_observed_undefined":false,"is_nominal_undefined":false,"has_low_registered_count":false,"has_low_specified_count":false,"has_few_source_rows":false,"has_low_support":false,"has_high_ns":false,"election_type":"midterm","section_count":3613,"LN_U":4440897,"section_ln_share_U":0.7145721060365285,"LN_R":600062,"section_ln_share_R":0.09655426980010826,"LN_M":1173805,"section_ln_share_M":0.18887362416336323,"supported_segments":750,"supported_LN":6213890,"supported_nominal_fraction":0.9998593671457194,"profile_ids":["adult_favorable","adult_unfavorable","older_favorable","older_unfavorable","young_favorable","young_unfavorable"]},{"election_year":2021,"state_code":"15","LN":12376600,"SV":6456957,"NV":5608286,"NS":311357,"source_row_count":915091,"sex_2_source_rows":0,"sex_2_nominal_count":0,"state_name":"MEXICO","district_reference_year":2021,"specified_count":12065243,"participation_observed":0.5351700749002735,"nonparticipation_observed":0.46482992509972654,"participation_nominal":0.5217068500234313,"unspecified_rate":0.025156909005704314,"is_observed_undefined":false,"is_nominal_undefined":false,"has_low_registered_count":false,"has_low_specified_count":false,"has_few_source_rows":false,"has_low_support":false,"has_high_ns":false,"election_type":"midterm","section_count":6544,"LN_U":9749233,"section_ln_share_U":0.7877149621059095,"LN_R":1567006,"section_ln_share_R":0.12661037764814245,"LN_M":1060361,"section_ln_share_M":0.085674660245948,"supported_segments":750,"supported_LN":12375570,"supported_nominal_fraction":0.9999167784367273,"profile_ids":["adult_favorable","adult_unfavorable","older_favorable","older_unfavorable","young_favorable","young_unfavorable"]},{"election_year":2021,"state_code":"16","LN":3574824,"SV":1619355,"NV":1737229,"NS":218240,"source_row_count":383926,"sex_2_source_rows":0,"sex_2_nominal_count":0,"state_name":"MICHOACAN","district_reference_year":2021,"specified_count":3356584,"participation_observed":0.4824413749216465,"nonparticipation_observed":0.5175586250783535,"participation_nominal":0.4529887345502884,"unspecified_rate":0.06104915934322921,"is_observed_undefined":false,"is_nominal_undefined":false,"has_low_registered_count":false,"has_low_specified_count":false,"has_few_source_rows":false,"has_low_support":false,"has_high_ns":false,"election_type":"midterm","section_count":2703,"LN_U":1955840,"section_ln_share_U":0.5471150467827227,"LN_R":949271,"section_ln_share_R":0.26554342255730634,"LN_M":669713,"section_ln_share_M":0.18734153065997095,"supported_segments":675,"supported_LN":3568079,"supported_nominal_fraction":0.9981131938243673,"profile_ids":["adult_favorable","adult_unfavorable","older_favorable","older_unfavorable","young_favorable","young_unfavorable"]},{"election_year":2021,"state_code":"17","LN":1496082,"SV":745103,"NV":691368,"NS":59611,"source_row_count":131347,"sex_2_source_rows":0,"sex_2_nominal_count":0,"state_name":"MORELOS","district_reference_year":2021,"specified_count":1436471,"participation_observed":0.5187038234673724,"nonparticipation_observed":0.4812961765326275,"participation_nominal":0.4980362038979147,"unspecified_rate":0.03984474113049953,"is_observed_undefined":false,"is_nominal_undefined":false,"has_low_registered_count":false,"has_low_specified_count":false,"has_few_source_rows":false,"has_low_support":false,"has_high_ns":false,"election_type":"midterm","section_count":916,"LN_U":1126705,"section_ln_share_U":0.7531037737236328,"LN_R":91996,"section_ln_share_R":0.061491281894976345,"LN_M":277381,"section_ln_share_M":0.18540494438139085,"supported_segments":210,"supported_LN":1495892,"supported_nominal_fraction":0.999873001613548,"profile_ids":["adult_favorable","adult_unfavorable","older_favorable","older_unfavorable","young_favorable","young_unfavorable"]},{"election_year":2021,"state_code":"18","LN":891505,"SV":443659,"NV":402586,"NS":45260,"source_row_count":129661,"sex_2_source_rows":0,"sex_2_nominal_count":0,"state_name":"NAYARIT","district_reference_year":2021,"specified_count":846245,"participation_observed":0.5242677947875615,"nonparticipation_observed":0.4757322052124385,"participation_nominal":0.497651723770478,"unspecified_rate":0.05076808318517563,